Sheet: SETUP
A1: Build a CDH - Monthly Premium
A3: Key | C3: Input Areas
F4: Instructions | G4: Help
F6: C/R Help | G6: HDHP Help | N6: DropDowns
K7: Current/Renewal | L7: HDHP | N7: Deductible Single | P7: OOP Single | R7: Copay | S7: Coinsurance | T7: Generic | U7: Brand | V7: HDHP Ded.
A8: Monthly Employee Cost - Traditional | J8: Deductible (Single) | K8: 100 | L8: 3500 | N8: 0 | P8: 0 | R8: 0 | S8: 0 | T8: 0 | U8: 0 | V8: 0
A9: EE Only | B9: EE + Sp. | C9: EE + Ch. | D9: EE + Fam. | J9: Deductible (Family) | K9: =R[-1]C*2 -> 200 | L9: =R[-1]C*2 -> 7000 | N9: 100 | P9: 50 | R9: 5 | S9: 0.1 | T9: 5 | U9: 5 | V9: 1100
A10: 0 | B10: 0 | C10: 0 | D10: 0 | J10: Out-of-Pocket Max (Single) | K10: 1000 | L10: 3500 | N10: =R[-1]C+50 -> 150 | P10: 100 | R10: 10 | S10: 0.2 | T10: 10 | U10: 10 | V10: =R[-1]C+50 -> 1150
J11: Out-of-Pocket Max (Family) | K11: =R[-1]C*2 -> 2000 | L11: =R[-1]C*2 -> 7000 | N11: =R[-1]C+50 -> 200 | P11: 150 | R11: 15 | S11: 0.3 | T11: 15 | U11: 15 | V11: =R[-1]C+50 -> 1200
A12: Monthly Employee Cost - HSA | J12: OV Copay | K12: 20 | N12: =R[-1]C+50 -> 250 | P12: 200 | R12: 20 | S12: 0.4 | T12: 20 | U12: 20 | V12: =R[-1]C+50 -> 1250
A13: EE | B13: ES | C13: EC | D13: EF | J13: In-Network Co-insurance % | K13: 0.2 | L13: 0.1 | N13: =R[-1]C+50 -> 300 | P13: 250 | R13: 25 | S13: 0.5 | T13: 25 | U13: 25 | V13: =R[-1]C+50 -> 1300
A14: 0 | B14: 0 | C14: 0 | D14: 0 | J14: Rx Generic Copay | K14: 10 | N14: =R[-1]C+50 -> 350 | P14: 300 | R14: 30 | T14: 30 | U14: 30 | V14: =R[-1]C+50 -> 1350
J15: Rx Brand Copay | K15: 25 | N15: =R[-1]C+50 -> 400 | P15: 350 | R15: 35 | T15: 35 | U15: 35 | V15: =R[-1]C+50 -> 1400
A16: Monthly Employer HSA Contributions | J16: ER Copay | K16: 50 | N16: =R[-1]C+50 -> 450 | P16: 400 | R16: 40 | T16: 40 | U16: 40 | V16: =R[-1]C+50 -> 1450
A17: EE | B17: ES | C17: EC | D17: EF | J17: Inpatient Copay | K17: 50 | N17: =R[-1]C+50 -> 500 | P17: 450 | R17: 45 | T17: 45 | U17: 45 | V17: =R[-1]C+50 -> 1500
A18: 0 | B18: 0 | C18: 0 | D18: 0 | J18: Outpatient Copay | K18: 50 | N18: =R[-1]C+50 -> 550 | P18: 500 | R18: 50 | T18: 50 | U18: 50 | V18: =R[-1]C+50 -> 1550
N19: =R[-1]C+50 -> 600 | P19: 550 | R19: 75 | T19: 55 | U19: 55 | V19: =R[-1]C+50 -> 1600
N20: =R[-1]C+50 -> 650 | P20: 600 | R20: 100 | T20: 60 | U20: 60 | V20: =R[-1]C+50 -> 1650
N21: =R[-1]C+50 -> 700 | P21: 650 | R21: 150 | T21: 65 | U21: 65 | V21: =R[-1]C+50 -> 1700
N22: =R[-1]C+50 -> 750 | P22: 700 | R22: 200 | T22: 70 | U22: 70 | V22: =R[-1]C+50 -> 1750
N23: =R[-1]C+50 -> 800 | P23: 750 | R23: 250 | T23: 75 | U23: 75 | V23: =R[-1]C+50 -> 1800
N24: =R[-1]C+50 -> 850 | P24: 800 | R24: 300 | V24: =R[-1]C+50 -> 1850
N25: =R[-1]C+50 -> 900 | P25: 850 | R25: 350 | V25: =R[-1]C+50 -> 1900
N26: =R[-1]C+50 -> 950 | P26: 900 | R26: 400 | V26: =R[-1]C+50 -> 1950
B27: + Medical Costs | C27: 300 | D27: 500 | N27: =R[-1]C+50 -> 1000 | P27: 950 | R27: 450 | V27: =R[-1]C+50 -> 2000
B28: - HSA | C28: 0 | D28: =INDEX(R[-6]C[-2]:R[-6]C[1],CoverageType)*12 -> 0 | N28: =R[-1]C+50 -> 1050 | P28: 1000 | R28: 500 | V28: =R[-1]C+50 -> 2050
B29: = Net Expenses | C29: =R[-2]C-R[-1]C -> 300 | D29: =IF(R[-2]C-R[-1]C<0,0,R[-2]C-R[-1]C) -> 500 | N29: =R[-1]C+50 -> 1100 | P29: 1050 | V29: =R[-1]C+50 -> 2100
B30: HSA Balance | C30: 0 | D30: =IF(R[-12]C[-2]-R[-3]C>0,R[-12]C[-2]-R[-3]C,0) -> 0 | N30: =R[-1]C+50 -> 1150 | P30: 1100 | V30: =R[-1]C+50 -> 2150
N31: =R[-1]C+50 -> 1200 | P31: 1150 | V31: =R[-1]C+50 -> 2200
B32: Custom Claims Scenario | E32: Pre-Built Scenarios | K32: Saving | L32: Save & Print | N32: =R[-1]C+50 -> 1250 | P32: 1200 | V32: =R[-1]C+50 -> 2250
B33: Cost ($) | C33: Frequency | E33: Cost ($) | F33: Frequency | K33: 1 | N33: =R[-1]C+50 -> 1300 | P33: 1250 | V33: =R[-1]C+50 -> 2300
B34: 80 | C34: 3 | D34: Office Visit(s) | E34: 70 | F34: =INDEX(R[12]C[-3]:R[12]C[1],1,ClaimsScenario) -> 0 | G34: =RC[-2] -> 70 | H34: =RC[-2] -> 0 | K34: 2 | N34: =R[-1]C+50 -> 1350 | P34: 1300 | V34: =R[-1]C+50 -> 2350
B35: 400 | C35: 1 | D35: Lab / X-ray(s) | E35: 400 | F35: =INDEX(R[12]C[-3]:R[12]C[1],1,ClaimsScenario) -> 0 | G35: =RC[-2] -> 400 | H35: =RC[-2] -> 0 | N35: =R[-1]C+50 -> 1400 | P35: 1350 | V35: =R[-1]C+50 -> 2400
B36: 12500 | C36: 3 | D36: Inpatient Surgery(ies) | E36: 12500 | F36: =INDEX(R[12]C[-3]:R[12]C[1],1,ClaimsScenario) -> 0 | G36: =RC[-2] -> 12500 | H36: =RC[-2] -> 0 | N36: =R[-1]C+50 -> 1450 | P36: 1400 | V36: =R[-1]C+50 -> 2450
B37: 4000 | C37: 2 | D37: Outpatient Surgery(ies) | E37: 4000 | F37: =INDEX(R[12]C[-3]:R[12]C[1],1,ClaimsScenario) -> 0 | G37: =RC[-2] -> 4000 | H37: =RC[-2] -> 0 | N37: =R[-1]C+50 -> 1500 | P37: 1450 | V37: =R[-1]C+50 -> 2500
B38: 2000 | C38: 3 | D38: Emergency Room | E38: 2000 | F38: =INDEX(R[12]C[-3]:R[12]C[1],1,ClaimsScenario) -> 0 | G38: =RC[-2] -> 2000 | H38: =RC[-2] -> 0 | N38: 2000 | P38: 1500 | V38: =R[-1]C+50 -> 2550
B39: 100 | C39: 2 | D39: Brand Rx | E39: 100 | F39: =INDEX(R[12]C[-3]:R[12]C[1],1,ClaimsScenario) -> 0 | G39: =RC[-2] -> 100 | H39: =RC[-2] -> 0 | N39: 2250 | P39: 1550 | V39: =R[-1]C+50 -> 2600
B40: 30 | C40: 1 | D40: Generic Rx | E40: 30 | F40: =INDEX(R[12]C[-3]:R[12]C[1],1,ClaimsScenario) -> 0 | G40: =RC[-2] -> 30 | H40: =RC[-2] -> 0 | N40: 2500 | P40: 1600 | V40: =R[-1]C+50 -> 2650
N41: 2750 | P41: 1650 | V41: =R[-1]C+50 -> 2700
N42: 3000 | P42: 1700 | V42: =R[-1]C+50 -> 2750
B43: Max HSA Amounts: | C43: 1250 | N43: 3250 | P43: 1750 | V43: =R[-1]C+50 -> 2800
D44: Pre-Built Lookup | N44: 3500 | P44: 1800 | V44: =R[-1]C+50 -> 2850
C45: Please Select Scenario… | D45: Typical | E45: Considerable | F45: Catastrophic | G45: Custom | N45: 3750 | P45: 1850 | V45: =R[-1]C+50 -> 2900
D46: 3 | E46: 8 | F46: 10 | N46: 4000 | P46: 1900 | V46: =R[-1]C+50 -> 2950
B47: Claims Scenario | D47: 1 | E47: 4 | F47: 5 | N47: 4250 | P47: 1950 | V47: =R[-1]C+50 -> 3000
B48: 1 | D48: 0 | E48: 0 | F48: 1 | N48: 4500 | P48: 2000 | V48: =R[-1]C+50 -> 3050
B49: =INDEX(R[-4]C[1]:R[-4]C[5],1,ClaimsScenario)&" Claims Scenario" -> Please Select Scenario… Claims Scenario | D49: 0 | E49: 0 | F49: 1 | N49: 4750 | P49: 2050 | V49: =R[-1]C+50 -> 3100
B50: Coverage Type | D50: 0 | E50: 1 | F50: 2 | N50: 5000 | P50: 2100 | V50: =R[-1]C+50 -> 3150
B51: EE Only | D51: 2 | E51: 8 | F51: 12 | N51: 5250 | P51: 2150 | V51: =R[-1]C+50 -> 3200
B52: EE + Spouse | D52: 1 | E52: 6 | F52: 12 | N52: 5500 | P52: 2200 | V52: =R[-1]C+50 -> 3250
B53: EE + Child(ren) | N53: 5750 | P53: 2250 | V53: =R[-1]C+50 -> 3300
B54: EE + Family | N54: 6000 | P54: 2300 | V54: =R[-1]C+50 -> 3350
B55: 1 | P55: 2350 | V55: =R[-1]C+50 -> 3400
P56: 2400 | V56: =R[-1]C+50 -> 3450
B57: Display OOP? | P57: 2450 | V57: =R[-1]C+50 -> 3500
B58: =IF(ClaimsScenario>1,1,0) -> 0 | P58: 2500 | V58: =R[-1]C+50 -> 3550
P59: 2550 | V59: =R[-1]C+50 -> 3600
B60: Display Custom? | P60: 2600 | V60: =R[-1]C+50 -> 3650
B61: =IF(AND(R[-3]C=1,ClaimsScenario=5),1,0) -> 0 | P61: 2650 | V61: =R[-1]C+50 -> 3700
P62: 2700 | V62: =R[-1]C+50 -> 3750
P63: 2750 | V63: =R[-1]C+50 -> 3800
P64: 2800 | V64: =R[-1]C+50 -> 3850
P65: 2850 | V65: =R[-1]C+50 -> 3900
P66: 2900 | V66: =R[-1]C+50 -> 3950
P67: 2950 | V67: =R[-1]C+50 -> 4000
P68: 3000 | V68: =R[-1]C+50 -> 4050
P69: 3050 | V69: =R[-1]C+50 -> 4100
P70: 3100 | V70: =R[-1]C+50 -> 4150
P71: 3150 | V71: =R[-1]C+50 -> 4200
P72: 3200 | V72: =R[-1]C+50 -> 4250
P73: 3250 | V73: =R[-1]C+50 -> 4300
P74: 3300 | V74: =R[-1]C+50 -> 4350
P75: 3350 | V75: =R[-1]C+50 -> 4400
P76: 3400 | V76: =R[-1]C+50 -> 4450
P77: 3450 | V77: =R[-1]C+50 -> 4500
P78: 3500 | V78: =R[-1]C+50 -> 4550
P79: 3550 | V79: =R[-1]C+50 -> 4600
P80: 3600 | V80: =R[-1]C+50 -> 4650
P81: 3650 | V81: =R[-1]C+50 -> 4700
P82: 3700 | V82: =R[-1]C+50 -> 4750
P83: 3750 | V83: =R[-1]C+50 -> 4800
P84: 3800 | V84: =R[-1]C+50 -> 4850
P85: 3850 | V85: =R[-1]C+50 -> 4900
P86: 3900 | V86: =R[-1]C+50 -> 4950
P87: 3950 | V87: =R[-1]C+50 -> 5000
P88: 4000 | V88: =R[-1]C+50 -> 5050
P89: 4050 | V89: =R[-1]C+50 -> 5100
P90: 4100 | V90: =R[-1]C+50 -> 5150
P91: 4150 | V91: =R[-1]C+50 -> 5200
P92: 4200 | V92: =R[-1]C+50 -> 5250
P93: 4250 | V93: =R[-1]C+50 -> 5300
P94: 4300 | V94: =R[-1]C+50 -> 5350
P95: 4350 | V95: =R[-1]C+50 -> 5400
P96: 4400 | V96: =R[-1]C+50 -> 5450
P97: 4450 | V97: =R[-1]C+50 -> 5500
P98: 4500 | V98: 5550
P99: 4550 | V99: 5600
P100: 4600 | V100: 5650
P101: 4650 | V101: 5700
P102: 4700 | V102: 5750
P103: 4750 | V103: 5800
P104: 4800 | V104: 5850
P105: 4850 | V105: 5900
P106: 4900 | V106: 5950
P107: 4950 | V107: 6000
P108: 5000 | V108: 6050
P109: 5050 | V109: 6100
P110: 5100 | V110: 6150
P111: 5150 | V111: 6200
P112: 5200 | V112: 6250
P113: 5250 | V113: 6300
P114: 5300 | V114: 6350
P115: 5350 | V115: 6400
P116: 5400 | V116: 6450
P117: 5450 | V117: 6500
P118: 5500 | V118: 6550
P119: 5550 | V119: 6600
P120: 5600 | V120: 6650
P121: 5650 | V121: 6700
P122: 5700 | V122: 6750
P123: 5750 | V123: 6800
P124: 5800 | V124: 6850
P125: 5850 | V125: 6900
P126: 5900 | V126: 6950
P127: 5950 | V127: 7000
P128: 6000 | V128: 7050
P129: 6050 | V129: 7100
P130: 6100 | V130: 7150
P131: 6150 | V131: 7200
P132: 6200 | V132: 7250
P133: 6250 | V133: 7300
P134: 6300 | V134: 7350
P135: 6350 | V135: 7400
P136: 6400 | V136: 7450
P137: 6450 | V137: 7500
P138: 6500 | V138: 7550
P139: 6550 | V139: 7600
P140: 6600 | V140: 7650
P141: 6650 | V141: 7700
P142: 6700 | V142: 7750
P143: 6750 | V143: 7800
P144: 6800 | V144: 7850
P145: 6850 | V145: 7900
P146: 6900 | V146: 7950
P147: 6950 | V147: 8000
P148: 7000 | V148: 8050
P149: 7050 | V149: 8100
P150: 7100 | V150: 8150
P151: 7150 | V151: 8200
P152: 7200 | V152: 8250
P153: 7250 | V153: 8300
P154: 7300 | V154: 8350
P155: 7350 | V155: 8400
P156: 7400 | V156: 8450
P157: 7450 | V157: 8500
P158: 7500 | V158: 8550
P159: 7550 | V159: 8600
P160: 7600 | V160: 8650
P161: 7650 | V161: 8700
P162: 7700 | V162: 8750
P163: 7750 | V163: 8800
P164: 7800 | V164: 8850
P165: 7850 | V165: 8900
P166: 7900 | V166: 8950
P167: 7950 | V167: 9000
P168: 8000 | V168: 9050
P169: 8050 | V169: 9100
P170: 8100 | V170: 9150
P171: 8150 | V171: 9200
P172: 8200 | V172: 9250
P173: 8250 | V173: 9300
P174: 8300 | V174: 9350
P175: 8350 | V175: 9400
P176: 8400 | V176: 9450
P177: 8450 | V177: 9500
P178: 8500 | V178: 9550
P179: 8550 | V179: 9600
P180: 8600 | V180: 9650
P181: 8650 | V181: 9700
P182: 8700 | V182: 9750
P183: 8750 | V183: 9800
P184: 8800 | V184: 9850
P185: 8850 | V185: 9900
P186: 8900 | V186: 9950
P187: 8950 | V187: 10000
P188: 9000 | V188: 10050
P189: 9050 | V189: 10100
P190: 9100 | V190: 10150
P191: 9150 | V191: 10200
P192: 9200 | V192: 10250
P193: 9250 | V193: 10300
P194: 9300 | V194: 10350
P195: 9350 | V195: 10400
P196: 9400 | V196: 10450
P197: 9450 | V197: 10500
P198: 9500 | V198: 10550
P199: 9550 | V199: 10600
P200: 9600 | V200: 10650
P201: 9650 | V201: 10700
P202: 9700 | V202: 10750
P203: 9750 | V203: 10800
P204: 9800 | V204: 10850
P205: 9850 | V205: 10900
P206: 9900 | V206: 10950
P207: 9950 | V207: 11000
P208: 10000 | V208: 11050
P209: 10050 | V209: 11100
P210: 10100 | V210: 11150
P211: 10150 | V211: 11200
P212: 10200 | V212: 11250
P213: 10250 | V213: 11300
P214: 10300 | V214: 11350
P215: 10350 | V215: 11400
P216: 10400 | V216: 11450
P217: 10450 | V217: 11500
P218: 10500 | V218: 11550
P219: 10550 | V219: 11600
P220: 10600 | V220: 11650
P221: 10650 | V221: 11700
P222: 10700 | V222: 11750
P223: 10750 | V223: 11800
P224: 10800 | V224: 11850
P225: 10850 | V225: 11900
P226: 10900 | V226: 11950
P227: 10950 | V227: 12000
P228: 11000 | V228: 12050
P229: 11050 | V229: 12100
P230: 11100 | V230: 12150
P231: 11150 | V231: 12200
P232: 11200 | V232: 12250
P233: 11250 | V233: 12300
P234: 11300 | V234: 12350
P235: 11350 | V235: 12400
P236: 11400 | V236: 12450
P237: 11450 | V237: 12500
P238: 11500 | V238: 12550
P239: 11550 | V239: 12600
P240: 11600 | V240: 12650
P241: 11650 | V241: 12700
P242: 11700 | V242: 12750
P243: 11750 | V243: 12800
P244: 11800 | V244: 12850
P245: 11850 | V245: 12900
P246: 11900 | V246: 12950
P247: 11950 | V247: 13000
P248: 12000 | V248: 13050
P249: 12050 | V249: 13100
P250: 12100 | V250: 13150
P251: 12150 | V251: 13200
P252: 12200 | V252: 13250
P253: 12250 | V253: 13300
P254: 12300 | V254: 13350
P255: 12350 | V255: 13400
P256: 12400 | V256: 13450
P257: 12450 | V257: 13500
P258: 12500 | V258: 13550
P259: 12550 | V259: 13600
P260: 12600 | V260: 13650
P261: 12650 | V261: 13700
P262: 12700 | V262: 13750
P263: 12750 | V263: 13800
P264: 12800 | V264: 13850
P265: 12850 | V265: 13900
P266: 12900 | V266: 13950
P267: 12950 | V267: 14000
P268: 13000
P269: 13050
P270: 13100
P271: 13150
P272: 13200
P273: 13250
P274: 13300
P275: 13350
P276: 13400
P277: 13450
P278: 13500
P279: 13550
P280: 13600
P281: 13650
P282: 13700
P283: 13750
P284: 13800
P285: 13850
P286: 13900
P287: 13950
P288: 14000

Sheet: CALC
B2: Claims Scenario | G2: Net Expenses Guage Limit
C3: Cost | D3: Frequency | E3: Total Cost | G3: =MAX(SETUP!R[6]C[4]+SETUP!R[8]C[4]+SETUP!R[9]C[4]*SETUP!R[43]C[-1]+SETUP!R[11]C[4]*SETUP!R[47]C[-1]+SETUP!R[12]C[4]*SETUP!R[48]C[-1],SETUP!R[6]C[5]+SETUP!R[8]C[5]) -> 14000
B4: Office Visit(s) | C4: =IF(ClaimsScenario=5,SETUP!R[30]C[-1],SETUP!R[30]C[2]) -> 70 | D4: =IF(ClaimsScenario=5,SETUP!R[30]C[-1],SETUP!R[30]C[2]) -> 0 | E4: =ovcost*ovfreq -> 0
B5: Lab / X-ray(s) | C5: =IF(ClaimsScenario=5,SETUP!R[30]C[-1],SETUP!R[30]C[2]) -> 400 | D5: =IF(ClaimsScenario=5,SETUP!R[30]C[-1],SETUP!R[30]C[2]) -> 0 | E5: =labxraycost*labxrayfreq -> 0
B6: Inpatient Surgery(ies) | C6: =IF(ClaimsScenario=5,SETUP!R[30]C[-1],SETUP!R[30]C[2]) -> 12500 | D6: =IF(ClaimsScenario=5,SETUP!R[30]C[-1],SETUP!R[30]C[2]) -> 0 | E6: =inpatientcost*inpatientfreq -> 0
B7: Outpatient Surgery(ies) | C7: =IF(ClaimsScenario=5,SETUP!R[30]C[-1],SETUP!R[30]C[2]) -> 4000 | D7: =IF(ClaimsScenario=5,SETUP!R[30]C[-1],SETUP!R[30]C[2]) -> 0 | E7: =outpatientcost*outpatientfreq -> 0
B8: Emergency Room | C8: =IF(ClaimsScenario=5,SETUP!R[30]C[-1],SETUP!R[30]C[2]) -> 2000 | D8: =IF(ClaimsScenario=5,SETUP!R[30]C[-1],SETUP!R[30]C[2]) -> 0 | E8: =ercost*erfreq -> 0
B9: Brand Rx | C9: =IF(ClaimsScenario=5,SETUP!R[30]C[-1],SETUP!R[30]C[2]) -> 100 | D9: =IF(ClaimsScenario=5,SETUP!R[30]C[-1],SETUP!R[30]C[2]) -> 0 | E9: =brandcost*brandfreq -> 0
B10: Generic Rx | C10: =IF(ClaimsScenario=5,SETUP!R[30]C[-1],SETUP!R[30]C[2]) -> 30 | D10: =IF(ClaimsScenario=5,SETUP!R[30]C[-1],SETUP!R[30]C[2]) -> 0 | E10: =genericcost*genericfreq -> 0
B13: Current/Renewal Calc
C14: Charges | F14: Plan Design
B15: Lab / X-ray(s) | C15: =R[-10]C[2] -> 0 | F15: Deductible | G15: =IF(CoverageType=1,SETUP!R[-7]C[4],SETUP!R[-6]C[4]) -> 4
B16: Inpatient Surgery(ies) | C16: =R[-10]C[2] -> 0 | F16: OOP Max | G16: =IF(CoverageType=1,SETUP!R[-6]C[4],SETUP!R[-5]C[4]) -> 1000
B17: Outpatient Surgery(ies) | C17: =R[-10]C[2] -> 0
B18: Emergency Room | C18: =R[-10]C[2] -> 0 | D18: =SUM(R[-3]C[-1]:RC[-1]) -> 0 | F18: Net Expenses
C19: Copays | F19: Deductible | G19: =IF(R[-1]C[-3]>R[-4]C,R[-4]C,R[-1]C[-3]) -> 0
B20: Office Visit(s) | C20: =ovfreq*SETUP!R[-8]C[8] -> 0 | F20: Coinsurance | G20: =IF(R[-2]C[-3]>R[-5]C,MIN(R[-4]C,(R[-2]C[-3]-R[-5]C)*SETUP!R[-7]C[4]),0) -> 0
B21: Brand Rx | C21: =brandfreq*SETUP!R[-6]C[8] -> 0 | F21: Copays | G21: =R[4]C[-3] -> 0 | H21: =SUM(R[-2]C[-1]:RC[-1]) -> 0
B22: Generic Rx | C22: =genericfreq*SETUP!R[-8]C[8] -> 0 | F22: Premium | G22: =INDEX(SETUP!R[-12]C[-6]:R[-12]C[-3],1,CoverageType)*12 -> 0
B23: ER Copay | C23: =erfreq*SETUP!R[-7]C[8] -> 0 | F23: guage | G23: =SUM(R[-4]C:R[-1]C) -> 0
B24: Inpatient Copay | C24: =inpatientfreq*SETUP!R[-7]C[8] -> 0
B25: Outpatient Copay | C25: =outpatientfreq*SETUP!R[-7]C[8] -> 0 | D25: =SUM(R[-5]C[-1]:RC[-1]) -> 0
B28: HDHP Calc
B29: Total Expenses | C29: =SUM(R[-25]C[2]:R[-19]C[2]) -> 0 | F29: Plan Design
F30: Deductible | G30: =IF(CoverageType=1,SETUP!R[-22]C[5],SETUP!R[-21]C[5]) -> 3500
F31: OOP Max | G31: =IF(CoverageType=1,SETUP!R[-21]C[5],SETUP!R[-20]C[5])-R[-1]C -> 0
F33: Net Expenses
F34: Deductible | G34: =IF(R[-5]C[-4]>R[-4]C,R[-4]C,R[-5]C[-4]) -> 0
F35: Coinsurance | G35: =IF(R[-6]C[-4]>R[-5]C,MIN(R[-4]C,(R[-6]C[-4]-R[-5]C)*SETUP!R[-22]C[5]),0) -> 0
G36: =SUM(R[-2]C:R[-1]C) -> 0
F37: less HSA | G37: =INDEX(SETUP!R[-19]C[-6]:R[-19]C[-3],1,CoverageType)*12 -> 0
B38: HSA Balance after Expenses | F38: Premium | G38: =INDEX(SETUP!R[-24]C[-6]:R[-24]C[-3],1,CoverageType)*12 -> 0 | I38: Annual Savings
C39: =IF(R[-2]C[4]>R[-3]C[4],R[-2]C[4]-R[-3]C[4],0) -> 0 | F39: guage | G39: =IF(R[-3]C-R[-2]C<0,0,R[-3]C-R[-2]C)+R[-1]C -> 0 | I39: =R[-16]C[-2]-RC[-2]+RC[-6] -> 0